{
  "$schema": "https://json-schema.org/draft/2020-12/schema",
  "$id": "https://overpass.dev/contracts/events/planning.plan.committed.v1.schema.json",
  "title": "PlanCommitted",
  "description": "A conflict-free CollectionPlan has been committed atomically for one satellite over one horizon bucket. This event is published from the transactional outbox in the SAME transaction that inserted the acquisitions, so the event exists if and only if the plan exists — there is no window in which a consumer can see a plan that was rolled back, or miss one that was not.\n\nWhat 'conflict-free' means, precisely, and what guarantees it:\n  1. No two acquisitions on this satellite overlap. Guaranteed by a tstzrange + GiST EXCLUDE constraint in Postgres, not by application logic — so no future code path, migration, or manual INSERT can violate it.\n  2. Consecutive acquisitions are separated by at least slew_time(a, b). Enforced by the planner and asserted by property-based tests over generated inputs.\n  3. Per-orbit duty-cycle budget is respected.\n  4. Every acquisition finishes before its request's deadline.\n\nSUPERSESSION: a bucket can be planned more than once, because rounds fire on either a cadence timer or an opportunity debounce. plan_version increments per (satellite_id, bucket_start) and supersedes_plan_id points at the plan replaced. Consumers must treat a lower plan_version arriving after a higher one as stale and drop it — ordering is not assumed anywhere in this system.",
  "type": "object",
  "additionalProperties": false,
  "required": ["event_id", "event_type", "schema_version", "occurred_at", "correlation_id", "causation_id", "producer", "data"],
  "properties": {
    "event_id": { "$ref": "../common/envelope.v1.schema.json#/$defs/EventId" },
    "event_type": { "enum": ["planning.plan.committed.v1"] },
    "schema_version": { "$ref": "../common/envelope.v1.schema.json#/$defs/SchemaVersion" },
    "occurred_at": { "$ref": "../common/envelope.v1.schema.json#/$defs/OccurredAt" },
    "correlation_id": { "$ref": "../common/envelope.v1.schema.json#/$defs/CorrelationId" },
    "causation_id": {
      "$ref": "../common/envelope.v1.schema.json#/$defs/CausationId",
      "description": "The event_id of the planning.round.triggered.v1 that opened this round."
    },
    "producer": { "enum": ["planner-service"] },
    "data": {
      "type": "object",
      "additionalProperties": false,
      "required": ["plan_id", "round_id", "satellite_id", "bucket", "plan_version", "policy", "committed_at", "acquisitions", "metrics"],
      "properties": {
        "plan_id": { "$ref": "../common/primitives.v1.schema.json#/$defs/Uuid" },
        "round_id": { "$ref": "../common/primitives.v1.schema.json#/$defs/Uuid" },
        "satellite_id": { "$ref": "../common/primitives.v1.schema.json#/$defs/SatelliteId" },
        "bucket": { "$ref": "../common/primitives.v1.schema.json#/$defs/TimeWindow" },
        "plan_version": {
          "type": "integer",
          "minimum": 1,
          "description": "Monotonic per (satellite_id, bucket.start). Backed by an optimistic-concurrency version column on collection_plans: a concurrent commit at the same version loses and retries, rather than silently overwriting."
        },
        "supersedes_plan_id": {
          "oneOf": [
            { "$ref": "../common/primitives.v1.schema.json#/$defs/Uuid" },
            { "type": "null" }
          ],
          "default": null
        },
        "policy": {
          "type": "string",
          "enum": ["GREEDY_BY_BID", "GREEDY_BY_VALUE_DENSITY", "VICKREY_SEALED_BID", "EXACT_DP"]
        },
        "committed_at": { "$ref": "../common/primitives.v1.schema.json#/$defs/Timestamp" },
        "acquisitions": {
          "type": "array",
          "maxItems": 2000,
          "description": "Ordered by window.start. An empty array is valid and meaningful: the satellite is deliberately idle for this bucket.",
          "items": {
            "type": "object",
            "additionalProperties": false,
            "required": ["acquisition_id", "request_id", "opportunity_id", "mode", "window", "geometry", "awarded_value_credits"],
            "properties": {
              "acquisition_id": { "$ref": "../common/primitives.v1.schema.json#/$defs/Uuid" },
              "request_id": { "$ref": "../common/primitives.v1.schema.json#/$defs/Uuid" },
              "opportunity_id": { "$ref": "../common/primitives.v1.schema.json#/$defs/Uuid" },
              "customer_id": { "$ref": "../common/primitives.v1.schema.json#/$defs/CustomerId" },
              "mode": { "$ref": "../common/sar.v1.schema.json#/$defs/ImagingMode" },
              "window": {
                "$ref": "../common/primitives.v1.schema.json#/$defs/TimeWindow",
                "description": "The committed acquisition interval — a concrete start chosen inside the opportunity's access_window, plus the dwell. This is the exact interval stored in the tstzrange column that the exclusion constraint guards."
              },
              "geometry": { "$ref": "../common/sar.v1.schema.json#/$defs/AccessGeometry" },
              "footprint": { "$ref": "../common/geometry.v1.schema.json#/$defs/Polygon" },
              "slew_time_from_previous_s": {
                "$ref": "../common/primitives.v1.schema.json#/$defs/DurationSeconds",
                "description": "Attitude manoeuvre plus settling time required after the preceding acquisition in this plan. Null-equivalent (absent) for the first acquisition. Carried on the event so the frontend timeline can render the slew gap as a real, occupied block rather than as apparent idle time — making the sequence-dependent setup cost visible is the difference between a Gantt chart and an explanation."
              },
              "gap_from_previous_s": {
                "$ref": "../common/primitives.v1.schema.json#/$defs/DurationSeconds",
                "description": "Actual idle time between the previous acquisition's end and this one's start. Must be >= slew_time_from_previous_s; the property-based test asserts this over arbitrary generated plans."
              },
              "duty_cycle_cost_s": { "$ref": "../common/primitives.v1.schema.json#/$defs/DurationSeconds" },
              "awarded_value_credits": {
                "$ref": "../common/primitives.v1.schema.json#/$defs/Credits",
                "description": "Effective value this acquisition contributed to the objective: a function of bid, priority-tier multiplier, and ageing. The function itself is planner configuration, deliberately not part of the contract."
              },
              "clearing_price_credits": {
                "oneOf": [
                  { "$ref": "../common/primitives.v1.schema.json#/$defs/Credits" },
                  { "type": "null" }
                ],
                "default": null,
                "description": "What the winner would actually pay. Set only under VICKREY_SEALED_BID, where the winner pays the runner-up's bid — the second-price rule that makes truthful bidding the dominant strategy. Null under the greedy and exact policies, which are pure optimisers with no pricing rule attached."
              }
            }
          }
        },
        "metrics": {
          "type": "object",
          "additionalProperties": false,
          "required": ["total_plan_value_credits", "requests_fulfilled", "candidate_opportunity_count", "duty_cycle_used_s", "duty_cycle_budget_s", "allocation_duration_ms"],
          "description": "The round's own scorecard. Carried on the event rather than only scraped from Prometheus so that policy comparison can be done by replaying the event log — the benchmark harness needs plan value and runtime side by side, per policy, over identical inputs.",
          "properties": {
            "total_plan_value_credits": { "$ref": "../common/primitives.v1.schema.json#/$defs/Credits" },
            "requests_fulfilled": { "type": "integer", "minimum": 0 },
            "requests_unfulfilled": { "type": "integer", "minimum": 0 },
            "candidate_opportunity_count": { "type": "integer", "minimum": 0 },
            "satellite_utilisation_ratio": {
              "$ref": "../common/primitives.v1.schema.json#/$defs/Ratio",
              "description": "Imaging seconds committed divided by imaging seconds available in the bucket. Read alongside duty_cycle_used_s: high utilisation with an exhausted duty cycle means the constraint that bound was power, not time."
            },
            "duty_cycle_used_s": { "$ref": "../common/primitives.v1.schema.json#/$defs/DurationSeconds" },
            "duty_cycle_budget_s": { "$ref": "../common/primitives.v1.schema.json#/$defs/DurationSeconds" },
            "total_slew_time_s": { "$ref": "../common/primitives.v1.schema.json#/$defs/DurationSeconds" },
            "allocation_duration_ms": { "$ref": "../common/primitives.v1.schema.json#/$defs/DurationMillis" },
            "optimality_ratio": {
              "oneOf": [
                { "$ref": "../common/primitives.v1.schema.json#/$defs/Ratio" },
                { "type": "null" }
              ],
              "default": null,
              "description": "This plan's value divided by the EXACT_DP optimum for the same input. Populated only in the benchmark harness, where ExactDP is run as ground truth on instances small enough to solve. The whole point of the Strategy pattern is to make this number measurable rather than assumed."
            }
          }
        }
      }
    }
  },
  "examples": [
    {
      "event_id": "dd44ee55-ff66-4a77-8b88-cc99dd00ee11",
      "event_type": "planning.plan.committed.v1",
      "schema_version": "1.0.0",
      "occurred_at": "2026-08-07T09:14:07.412Z",
      "correlation_id": "4d5e6f7a-8b9c-4d0e-8f1a-2b3c4d5e6f7a",
      "causation_id": "cc33dd44-ee55-4f66-8a77-bb88cc99dd00",
      "producer": "planner-service",
      "data": {
        "plan_id": "7a8b9c0d-1e2f-4a3b-8c4d-5e6f7a8b9c0d",
        "round_id": "6f7a8b9c-0d1e-4f2a-8b3c-4d5e6f7a8b9c",
        "satellite_id": "SENTINEL-1A",
        "bucket": { "start": "2026-08-07T18:00:00Z", "end": "2026-08-08T00:00:00Z" },
        "plan_version": 1,
        "supersedes_plan_id": null,
        "policy": "GREEDY_BY_VALUE_DENSITY",
        "committed_at": "2026-08-07T09:14:07.400Z",
        "acquisitions": [
          {
            "acquisition_id": "9c0d1e2f-3a4b-4c5d-8e6f-7a8b9c0d1e2f",
            "request_id": "3c4d5e6f-7a8b-4c9d-8e1f-2a3b4c5d6e7f",
            "opportunity_id": "d1e2f3a4-b5c6-4d7e-8f90-1a2b3c4d5e6f",
            "customer_id": "civil-protection-pt",
            "mode": "SPOTLIGHT",
            "window": { "start": "2026-08-07T18:32:20Z", "end": "2026-08-07T18:32:32.5Z" },
            "geometry": {
              "incidence_angle_deg": 33.7,
              "look_side": "RIGHT",
              "squint_angle_deg": -4.1,
              "slant_range_km": 812.4,
              "elevation_angle_deg": 54.9,
              "roll_angle_deg": 29.2
            },
            "slew_time_from_previous_s": 0,
            "gap_from_previous_s": 0,
            "duty_cycle_cost_s": 18.5,
            "awarded_value_credits": 11250,
            "clearing_price_credits": null
          }
        ],
        "metrics": {
          "total_plan_value_credits": 11250,
          "requests_fulfilled": 1,
          "requests_unfulfilled": 0,
          "candidate_opportunity_count": 412,
          "satellite_utilisation_ratio": 0.031,
          "duty_cycle_used_s": 18.5,
          "duty_cycle_budget_s": 600,
          "total_slew_time_s": 0,
          "allocation_duration_ms": 37,
          "optimality_ratio": null
        }
      }
    }
  ]
}
